{
  "requested_model": "gpt-4.1-mini",
  "routed_by_prefix": false,
  "resolved_provider": "openai",
  "resolved_model": "gpt-4.1-mini",
  "resolution_reason": "model_catalog_match",
  "degraded": false,
  "sources": {
    "model": "environment",
    "provider": "model_catalog_match"
  },
  "provider_id": "openai",
  "auth_status": "configured",
  "auth_source": "environment",
  "auth_env_var": "OPENAI_API_KEY",
  "auth_shape": "api_key",
  "base_url": "http://example.test/v1",
  "base_url_source": "environment",
  "catalog_source": "embedded",
  "supported_models": [
    "gpt-5.4",
    "gpt-5.5",
    "gpt-5.4-mini",
    "gpt-5",
    "gpt-5-mini",
    "gpt-4.1",
    "gpt-4.1-mini"
  ],
  "chat_completion_streaming": true,
  "chat_completion_streaming_source": "default"
}
